{
  "meta": {
    "schema_version": "0.5.0",
    "esaa_version": "0.5.0-ui-redesign-esaa-supervisor",
    "immutable_done": true,
    "master_correlation_id": null,
    "run": {
      "run_id": null,
      "status": "initialized",
      "last_event_seq": 111,
      "projection_hash_sha256": "5e2a90185663fe5b596f378747524aebad83e8b5f28d4730db8f13aa214ac9cc",
      "verify_status": "ok"
    },
    "updated_at": "2026-03-07T11:15:00Z"
  },
  "project": {
    "name": "esaa-supervisor-ui-redesign",
    "audit_scope": "Redesign da interface do ESAA Supervisor com foco em arquitetura visual, melhoria de UX operacional, dashboard executivo, navegação colapsável estilo app shell, gráficos úteis, drawers, modais, console dock e reorganização das telas em visão geral, tarefas, execução, atividade, integridade e artefatos."
  },
  "tasks": [
    {
      "task_id": "UIR-SPEC-001",
      "task_kind": "spec",
      "title": "Especificar arquitetura da informação e navegação do redesign",
      "description": "Definir a arquitetura da informação do ESAA Supervisor, reorganizando a aplicação em rotas e seções claras: visão geral, tarefas, execução, atividade, integridade, issues, lessons, artefatos e configuração. A especificação deve descrever o novo app shell com topbar, sidebar colapsável e áreas contextuais, eliminando o modelo atual de página longa com excesso de scroll.",
      "status": "done",
      "depends_on": [],
      "targets": [
        "frontend/src/",
        "docs/ui-redesign/"
      ],
      "outputs": {
        "files": [
          "docs/ui-redesign/information-architecture.md",
          "docs/ui-redesign/navigation-map.md"
        ]
      },
      "immutability": {
        "done_is_immutable": true
      },
      "planning": {
        "complexity": "high",
        "planned_agent": "agent-spec",
        "preferred_runner": "claude-code",
        "routing_reason": "Define a espinha dorsal da navegação e da organização conceitual do produto.",
        "fallback_runners": [
          "codex",
          "gemini-cli"
        ],
        "planning_notes": "Base estrutural do redesign; precisa de boa visão sistêmica."
      },
      "required_verification": [
        "Documento define rotas e seções operacionais do sistema",
        "Documento substitui a home longa por arquitetura baseada em telas",
        "Documento inclui sidebar colapsável para liberar espaço de conteúdo"
      ],
      "assigned_to": "claude-code",
      "completed_at": "2026-03-07T08:21:00Z"
    },
    {
      "task_id": "UIR-SPEC-002",
      "task_kind": "spec",
      "title": "Especificar app shell, sidebar colapsável e comportamento responsivo",
      "description": "Definir o app shell principal da aplicação, incluindo topbar fixa, sidebar esquerda em modo expandido e colapsado, comportamento de ocultar menu para priorizar o conteúdo e regras responsivas para desktop e viewport menores. A especificação deve detalhar a interação de abrir/fechar menu, persistência de preferência e impacto no grid principal.",
      "status": "done",
      "depends_on": [],
      "targets": [
        "frontend/src/components/",
        "docs/ui-redesign/"
      ],
      "outputs": {
        "files": [
          "docs/ui-redesign/app-shell-spec.md",
          "docs/ui-redesign/responsive-behavior-spec.md"
        ]
      },
      "immutability": {
        "done_is_immutable": true
      },
      "planning": {
        "complexity": "high",
        "planned_agent": "agent-spec",
        "preferred_runner": "claude-code",
        "routing_reason": "É a peça crítica para o comportamento de layout inspirado no menu recolhível.",
        "fallback_runners": [
          "codex",
          "gemini-cli"
        ],
        "planning_notes": "Precisa especificar estados, persistência e impacto no grid."
      },
      "required_verification": [
        "Especificação inclui modo expandido e colapsado da sidebar",
        "Especificação prevê ganho de largura útil no conteúdo principal",
        "Especificação define comportamento consistente para desktop e tela reduzida"
      ],
      "assigned_to": "claude-code",
      "completed_at": "2026-03-07T08:21:00Z"
    },
    {
      "task_id": "UIR-SPEC-003",
      "task_kind": "spec",
      "title": "Especificar visão geral executiva com KPIs e gráficos operacionais",
      "description": "Definir a nova tela inicial do projeto com KPIs, resumos de status, gráficos úteis e painéis curtos para leitura rápida do estado do projeto. A tela deve responder em poucos segundos o que está acontecendo no projeto, o que está bloqueado, qual é a próxima tarefa elegível e qual o estado da integridade geral.",
      "status": "done",
      "depends_on": [],
      "targets": [
        "frontend/src/pages/",
        "docs/ui-redesign/"
      ],
      "outputs": {
        "files": [
          "docs/ui-redesign/overview-dashboard-spec.md",
          "docs/ui-redesign/charts-and-kpis-spec.md"
        ]
      },
      "immutability": {
        "done_is_immutable": true
      },
      "planning": {
        "complexity": "medium",
        "planned_agent": "agent-spec",
        "preferred_runner": "codex",
        "routing_reason": "Há forte componente estrutural, mas escopo de especificação é bem delimitado.",
        "fallback_runners": [
          "claude-code",
          "gemini-cli"
        ],
        "planning_notes": "Foco em KPI, gráficos e leitura rápida do estado."
      },
      "assigned_to": "codex",
      "started_at": "2026-03-07T01:40:00Z",
      "completed_at": "2026-03-07T01:40:00Z",
      "verification": {
        "checks": [
          "Documento define cards KPI principais e regras de leitura executiva da tela inicial.",
          "Documento define ao menos dois graficos operacionais uteis e seu papel na operacao.",
          "Documento define paineis de proxima tarefa, problemas em aberto e atividade recente resumida."
        ]
      },
      "required_verification": [
        "Documento define cards KPI principais",
        "Documento define ao menos dois gráficos operacionais úteis",
        "Documento define painéis de próximas tarefas, problemas e atividade resumida"
      ]
    },
    {
      "task_id": "UIR-SPEC-004",
      "task_kind": "spec",
      "title": "Especificar experiência da tela de tarefas com grid e drawer lateral",
      "description": "Definir a experiência principal da tela de tarefas with tabela/data grid, filtros, busca, ordenação, badges de status, ações por linha e drawer lateral de detalhes da task. A especificação deve eliminar o fluxo atual de detalhes dispersos na página e adotar inspeção contextual sem perda de foco.",
      "status": "done",
      "depends_on": [],
      "targets": [
        "frontend/src/components/",
        "docs/ui-redesign/"
      ],
      "outputs": {
        "files": [
          "docs/ui-redesign/tasks-grid-spec.md",
          "docs/ui-redesign/task-detail-drawer-spec.md"
        ]
      },
      "immutability": {
        "done_is_immutable": true
      },
      "planning": {
        "complexity": "medium",
        "planned_agent": "agent-spec",
        "preferred_runner": "codex",
        "routing_reason": "É uma especificação operacional importante, porém com componentes conhecidos de UX.",
        "fallback_runners": [
          "claude-code",
          "gemini-cli"
        ],
        "planning_notes": "Definir colunas, filtros, ações e detalhe contextual."
      },
      "assigned_to": "codex",
      "started_at": "2026-03-07T01:47:00Z",
      "completed_at": "2026-03-07T01:47:00Z",
      "verification": {
        "checks": [
          "Documento define colunas, filtros, busca e ordenacao da grid de tasks.",
          "Documento define drawer lateral de detalhes com secoes de resumo, elegibilidade, atividade e outputs.",
          "Documento descreve acoes contextuais sem exigir navegacao longa para inspecao."
        ]
      },
      "required_verification": [
        "Documento define colunas e filtros da grid de tasks",
        "Documento define drawer lateral de detalhes com abas ou seções",
        "Documento descreve ações contextuais sem exigir navegação longa"
      ]
    },
    {
      "task_id": "UIR-SPEC-005",
      "task_kind": "spec",
      "title": "Especificar superfícies complementares: modais, drawer, console dock e catálogo de artefatos",
      "description": "Definir as superfícies complementares da nova UI, incluindo modais para integridade e payloads, drawers para detalhes rápidos, console dock para execução ao vivo e tela dedicada de catálogo de artefatos canônicos. A especificação deve retirar artefatos da área central da home e colocá-los em uma experiência adequada de inventário e inspeção.",
      "status": "done",
      "depends_on": [],
      "targets": [
        "frontend/src/components/",
        "docs/ui-redesign/"
      ],
      "outputs": {
        "files": [
          "docs/ui-redesign/surfaces-spec.md",
          "docs/ui-redesign/artifacts-catalog-spec.md",
          "docs/ui-redesign/run-console-dock-spec.md"
        ]
      },
      "immutability": {
        "done_is_immutable": true
      },
      "planning": {
        "complexity": "medium",
        "planned_agent": "agent-spec",
        "preferred_runner": "codex",
        "routing_reason": "Especificação de padrões UI reutilizáveis com escopo relativamente controlado.",
        "fallback_runners": [
          "claude-code",
          "gemini-cli"
        ],
        "planning_notes": "Inclui padrões de superfícies complementares e catálogo dedicado."
      },
      "assigned_to": "codex",
      "started_at": "2026-03-07T01:54:00Z",
      "completed_at": "2026-03-07T01:54:00Z",
      "verification": {
        "checks": [
          "Documento define uso coordenado de modais, drawers e console dock inferior.",
          "Documento move artefatos para catalogo dedicado de inventario e inspecao.",